{
  "sdk_schema": 1,
  "reuse_v0_names": true,
  "provisional_markers": {
    "A4": "the content of build_info capabilities: which formats and document flags a build reports",
    "A5": "process initialization and the time-zone contract: whether an init call survives, and where a zone is set",
    "A6": "settings channels and process defaults: whether a context handle exists and which calls take it",
    "A7": "the thread contract: the thread class of each call",
    "A8": "schema construction: one call over a whole CREATE TABLE statement, and its settings input",
    "A9": "how filters and blocks bind to a schema",
    "A10": "the row, batch and filter result documents: fields, outcomes, vocabularies, and which refusals are call statuses",
    "A11": "derived results computed in the library: the Transformed classifier and the discovery kit",
    "A12": "column introspection, and how a column name that is not valid UTF-8 is carried inside a JSON document",
    "A13": "teardown: shutdown, background threads, and unloading the library",
    "Q-c": "the form of the error accessors' text results, and the error-code table's buffer format",
    "Q-f": "whether the discovery call also returns the query text a caller runs against a server",
    "confirm": "outside the decided set: the SDK's proposed form, waiting on the confirmation of the whole ABI"
  },
  "errors": {
    "fields": ["status", "ch_code", "ch_name", "message", "column"],
    "codes": {
      "artifact_incompatible": "CHTYPES_ARTIFACT_INCOMPATIBLE",
      "artifact_corrupt": "CHTYPES_ARTIFACT_CORRUPT"
    },
    "classes": {
      "schema": {"go": "*SchemaError", "python": "SchemaError", "ts": "SchemaError", "rust": "Error::Schema", "new": false},
      "unsupported": {"go": "*UnsupportedError", "python": "UnsupportedError", "ts": "UnsupportedError", "rust": "Error::Unsupported", "new": false},
      "usage": {"go": "*UsageError", "python": "UsageError", "ts": "UsageError", "rust": "Error::Usage", "new": true},
      "internal": {"go": "*InternalError", "python": "InternalError", "ts": "InternalError", "rust": "Error::Internal", "new": true},
      "artifact_incompatible": {"go": "*ArtifactError", "python": "ArtifactIncompatibleError", "ts": "ArtifactIncompatibleError", "rust": "Error::ArtifactIncompatible", "new": true},
      "artifact_corrupt": {"go": "*ArtifactError", "python": "ArtifactCorruptError", "ts": "ArtifactCorruptError", "rust": "Error::ArtifactCorrupt", "new": false}
    },
    "status": {
      "CHS_OK": null,
      "CHS_REJECTED": "schema",
      "CHS_DECLINED": "unsupported",
      "CHS_INVALID_ARGUMENT": "usage",
      "CHS_INTERNAL": "internal",
      "unknown": "internal"
    }
  },
  "loader": {
    "dlopen_flags": ["RTLD_NOW", "RTLD_LOCAL"],
    "unverified_env": "CHTYPES_ALLOW_UNVERIFIED_LIBRARY",
    "refusals": [
      {"step": 1, "reason": "glibc_floor", "error": "artifact_incompatible"},
      {"step": 1, "reason": "no_glibc", "error": "artifact_incompatible"},
      {"step": 1, "reason": "predicate_malformed", "error": "artifact_incompatible"},
      {"step": 2, "reason": "dlopen", "error": "artifact_incompatible"},
      {"step": 3, "reason": "not_v1", "error": "artifact_incompatible"},
      {"step": 3, "reason": "abi_version", "error": "artifact_incompatible"},
      {"step": 4, "reason": "build_info_malformed", "error": "artifact_corrupt"},
      {"step": 4, "reason": "fingerprint", "error": "artifact_incompatible"},
      {"step": 5, "reason": "build_info_mismatch", "suffix": "field", "error": "artifact_corrupt"},
      {"step": 6, "reason": "missing_symbol", "suffix": "symbol", "error": "artifact_incompatible"}
    ]
  },
  "cross_check": [
    {"build_info": "abi", "predicate": "abi", "compare": "int"},
    {"build_info": "abi_fingerprint", "predicate": "abi_fingerprint", "compare": "bytes"},
    {"build_info": "clickhouse_version", "predicate": "clickhouse_version", "compare": "bytes"},
    {"build_info": "channel", "predicate": "channel", "compare": "bytes"},
    {"build_info": "build", "predicate": "build", "compare": "bytes"},
    {"build_info": "os", "predicate": "os", "compare": "bytes"},
    {"build_info": "arch", "predicate": "arch", "compare": "bytes"},
    {"build_info": "core_commit", "predicate": "core_commit", "compare": "bytes"},
    {"build_info": "inputs_sha256", "predicate": "inputs_sha256", "compare": "bytes"}
  ],
  "naming": {
    "go": {},
    "python": {},
    "ts": {},
    "rust": {}
  }
}
